{
  "schemaVersion": "1.0.0",
  "generatedAt": "2026-09-05T17:25:00.000Z",
  "candidateSha256": "fdf8220092850f2d5baf6669fad37167b815a69a21099f992a1e23c65c9ace2c",
  "owners": {
    "release": "@QuyDu",
    "securityResponse": "@QuyDu",
    "artifactRevocation": "@QuyDu"
  },
  "signals": [
    { "id": "github-security-validation", "status": "passing", "checkedAt": "2026-09-05T17:24:34.455Z", "evidence": "Run 33980792156 passed all thirteen jobs for merge commit 5190959." },
    { "id": "github-codeql", "status": "passing", "checkedAt": "2026-09-05T17:24:34.455Z", "evidence": "Run 33980792246 passed for merge commit 5190959 with zero open alerts." },
    { "id": "github-secret-scanning", "status": "passing", "checkedAt": "2026-09-05T17:05:00.000Z", "evidence": "Secret scanning and push protection are enabled." },
    { "id": "github-dependabot-alerts", "status": "passing", "checkedAt": "2026-09-05T17:05:00.000Z", "evidence": "Vulnerability alerts, security updates, and automated fixes are enabled." },
    { "id": "private-vulnerability-reports", "status": "passing", "checkedAt": "2026-09-05T17:05:00.000Z", "evidence": "Private vulnerability reporting is enabled." },
    { "id": "internal-artifact-install-health", "status": "blocked", "checkedAt": null, "evidence": "No approved internal artifact destination or health signal is configured." },
    { "id": "artifact-revocation-status", "status": "blocked", "checkedAt": null, "evidence": "No approved internal artifact destination or tested revocation operation exists." }
  ],
  "revocation": {
    "status": "not-configured",
    "owner": "@QuyDu",
    "testedAt": null,
    "evidence": "Revocation cannot be tested until an internal artifact repository and owner are designated."
  }
}